{
  "$schema": "http://json-schema.org/draft-07/schema#",
  "title": "Tauri Project User Input Analysis",
  "description": "Structured analysis of user input for Tauri application planning",
  "type": "object",
  "required": [
    "project_name",
    "raw_user_input",
    "key_objectives",
    "technical_constraints",
    "success_criteria",
    "risks_and_mitigations",
    "required_features",
    "open_questions",
    "codebase_analysis_scope"
  ],
  "additionalProperties": false,
  "properties": {
    "project_name": {
      "type": "string",
      "pattern": "^[a-z0-9-]+$",
      "minLength": 3,
      "maxLength": 50,
      "description": "Kebab-case project identifier derived from user input"
    },
    "raw_user_input": {
      "type": "string",
      "minLength": 10,
      "maxLength": 10000,
      "description": "Original user input as provided"
    },
    "key_objectives": {
      "type": "array",
      "minItems": 1,
      "maxItems": 10,
      "description": "Primary goals and objectives of the project",
      "items": {
        "type": "object",
        "required": ["id", "objective", "priority", "category"],
        "additionalProperties": false,
        "properties": {
          "id": {
            "type": "string",
            "pattern": "^OBJ-\\d{3}$",
            "description": "Unique objective identifier (e.g., OBJ-001)"
          },
          "objective": {
            "type": "string",
            "minLength": 20,
            "maxLength": 300,
            "description": "Clear, measurable objective statement"
          },
          "priority": {
            "type": "string",
            "enum": ["critical", "high", "medium", "low"],
            "description": "Priority level for this objective"
          },
          "category": {
            "type": "string",
            "enum": ["functional", "performance", "user-experience", "technical", "business"],
            "description": "Category of objective"
          },
          "success_indicators": {
            "type": "array",
            "items": {
              "type": "string",
              "minLength": 10,
              "maxLength": 200
            },
            "minItems": 1,
            "maxItems": 5,
            "description": "Measurable indicators of success"
          }
        }
      }
    },
    "technical_constraints": {
      "type": "object",
      "required": ["constraints_list"],
      "additionalProperties": false,
      "properties": {
        "constraints_list": {
          "type": "array",
          "minItems": 0,
          "maxItems": 20,
          "description": "List of technical constraints and limitations",
          "items": {
            "type": "object",
            "required": ["id", "constraint", "impact", "mitigation"],
            "additionalProperties": false,
            "properties": {
              "id": {
                "type": "string",
                "pattern": "^TC-\\d{3}$",
                "description": "Technical constraint identifier (e.g., TC-001)"
              },
              "constraint": {
                "type": "string",
                "minLength": 20,
                "maxLength": 300,
                "description": "Description of the constraint"
              },
              "impact": {
                "type": "string",
                "enum": ["critical", "high", "medium", "low"],
                "description": "Impact level on project"
              },
              "mitigation": {
                "type": "string",
                "minLength": 20,
                "maxLength": 500,
                "description": "Strategy to handle or work around the constraint"
              }
            }
          }
        }
      }
    },
    "success_criteria": {
      "type": "array",
      "minItems": 1,
      "maxItems": 15,
      "description": "Measurable criteria for project success",
      "items": {
        "type": "object",
        "required": ["id", "criterion", "measurement", "target", "category"],
        "additionalProperties": false,
        "properties": {
          "id": {
            "type": "string",
            "pattern": "^SC-\\d{3}$",
            "description": "Success criterion identifier (e.g., SC-001)"
          },
          "criterion": {
            "type": "string",
            "minLength": 20,
            "maxLength": 300,
            "description": "Clear statement of success criterion"
          },
          "measurement": {
            "type": "string",
            "minLength": 10,
            "maxLength": 200,
            "description": "How this criterion will be measured"
          },
          "target": {
            "type": "string",
            "minLength": 5,
            "maxLength": 100,
            "description": "Target value or outcome (e.g., '< 100ms', '99.9% uptime')"
          },
          "category": {
            "type": "string",
            "enum": ["performance", "functionality", "usability", "reliability", "security", "maintainability"],
            "description": "Category of success criterion"
          },
          "priority": {
            "type": "string",
            "enum": ["must-have", "should-have", "nice-to-have"],
            "description": "Priority level using MoSCoW method"
          }
        }
      }
    },
    "risks_and_mitigations": {
      "type": "array",
      "minItems": 1,
      "maxItems": 20,
      "description": "Identified risks and their mitigation strategies",
      "items": {
        "type": "object",
        "required": ["id", "risk", "probability", "impact", "mitigation_strategy", "contingency_plan"],
        "additionalProperties": false,
        "properties": {
          "id": {
            "type": "string",
            "pattern": "^RISK-\\d{3}$",
            "description": "Risk identifier (e.g., RISK-001)"
          },
          "risk": {
            "type": "string",
            "minLength": 20,
            "maxLength": 300,
            "description": "Description of the risk"
          },
          "category": {
            "type": "string",
            "enum": ["technical", "resource", "schedule", "scope", "external", "quality"],
            "description": "Risk category"
          },
          "probability": {
            "type": "string",
            "enum": ["very-low", "low", "medium", "high", "very-high"],
            "description": "Likelihood of risk occurring"
          },
          "impact": {
            "type": "string",
            "enum": ["negligible", "minor", "moderate", "major", "catastrophic"],
            "description": "Impact if risk materializes"
          },
          "risk_score": {
            "type": "integer",
            "minimum": 1,
            "maximum": 25,
            "description": "Calculated risk score (probability Ã— impact)"
          },
          "mitigation_strategy": {
            "type": "string",
            "minLength": 30,
            "maxLength": 500,
            "description": "Proactive strategy to prevent or reduce risk"
          },
          "contingency_plan": {
            "type": "string",
            "minLength": 30,
            "maxLength": 500,
            "description": "Reactive plan if risk occurs"
          },
          "owner": {
            "type": "string",
            "minLength": 2,
            "maxLength": 50,
            "description": "Person/role responsible for monitoring this risk"
          }
        }
      }
    },
    "required_features": {
      "type": "array",
      "minItems": 1,
      "maxItems": 30,
      "description": "List of required features for the application",
      "items": {
        "type": "object",
        "required": ["id", "feature", "priority", "complexity", "dependencies"],
        "additionalProperties": false,
        "properties": {
          "id": {
            "type": "string",
            "pattern": "^FEAT-\\d{3}$",
            "description": "Feature identifier (e.g., FEAT-001)"
          },
          "feature": {
            "type": "string",
            "minLength": 20,
            "maxLength": 300,
            "description": "Clear description of the feature"
          },
          "category": {
            "type": "string",
            "enum": ["core", "authentication", "data-management", "ui-ux", "integration", "security", "performance", "analytics"],
            "description": "Feature category"
          },
          "priority": {
            "type": "string",
            "enum": ["must-have", "should-have", "nice-to-have"],
            "description": "Priority using MoSCoW method"
          },
          "complexity": {
            "type": "string",
            "enum": ["trivial", "simple", "moderate", "complex", "very-complex"],
            "description": "Implementation complexity"
          },
          "estimated_effort": {
            "type": "string",
            "pattern": "^\\d+-\\d+\\s+(hours|days)$",
            "description": "Estimated effort range (e.g., '4-8 hours', '2-3 days')"
          },
          "dependencies": {
            "type": "array",
            "items": {
              "type": "string",
              "pattern": "^FEAT-\\d{3}$"
            },
            "description": "IDs of features this depends on"
          },
          "acceptance_criteria": {
            "type": "array",
            "items": {
              "type": "string",
              "minLength": 15,
              "maxLength": 200
            },
            "minItems": 1,
            "maxItems": 10,
            "description": "Testable acceptance criteria"
          }
        }
      }
    },
    "open_questions": {
      "type": "array",
      "minItems": 0,
      "maxItems": 30,
      "description": "Questions requiring clarification through codebase analysis or user interaction",
      "items": {
        "type": "object",
        "required": ["id", "question", "category", "priority", "context"],
        "additionalProperties": false,
        "properties": {
          "id": {
            "type": "string",
            "pattern": "^Q-\\d{3}$",
            "description": "Question identifier (e.g., Q-001)"
          },
          "question": {
            "type": "string",
            "minLength": 20,
            "maxLength": 500,
            "description": "The question requiring clarification"
          },
          "category": {
            "type": "string",
            "enum": ["architecture", "implementation", "integration", "data-model", "user-flow", "performance", "security", "compatibility"],
            "description": "Question category"
          },
          "priority": {
            "type": "string",
            "enum": ["blocking", "high", "medium", "low"],
            "description": "Priority for getting answer"
          },
          "context": {
            "type": "string",
            "minLength": 30,
            "maxLength": 500,
            "description": "Context explaining why this question matters"
          },
          "resolution_source": {
            "type": "string",
            "enum": ["codebase-analysis", "user-qa", "research", "documentation"],
            "description": "Expected source for answer"
          },
          "blocks": {
            "type": "array",
            "items": {
              "type": "string",
              "pattern": "^(FEAT|OBJ|TC|SC|RISK)-\\d{3}$"
            },
            "description": "IDs of items blocked by this question"
          }
        }
      }
    },
    "codebase_analysis_scope": {
      "type": "object",
      "description": "Scope for codebase analysis (if required)",
      "properties": {
        "target_directories": {
          "type": "array",
          "items": {
            "type": "string"
          },
          "description": "Directories to analyze"
        },
        "focus_areas": {
          "type": "array",
          "items": {
            "type": "string",
            "enum": ["architecture", "data-models", "api-integration", "state-management", "routing", "authentication", "business-logic"]
          },
          "description": "Specific areas requiring analysis"
        }
      }
    }
  }
}